,ID,_id,datetime,has_media,is_reply,is_retweet,medias,nbr_favorite,nbr_reply,nbr_retweet,text,url,user_id,usernameTweet
331,988466476129533952,5af88ac724c1c400cc54df58,2018-04-23 19:15:47,,False,False,,1,1,0,Great.. woke up with a  sore   throat  and  runny   nose .,/Ronleephoto/status/988466476129533952,198608955,Ronleephoto
332,988463847957671936,5af88ac724c1c400cc54df59,2018-04-23 19:05:20,,False,False,,0,0,0,Bring on the  sore   throat  and  runny   nose ....,/na_coleen27/status/988463847957671936,429320298,na_coleen27
333,988462099234877440,5af88ac724c1c400cc54df5a,2018-04-23 18:58:23,,False,False,,0,0,0,"Itchy watery eyes, snotty  nose ,  sore   throat ,  headache . I am feeling miserable. If I could just rip my head off during this season that would be amazing.",/alphagoddess23/status/988462099234877440,631555705,alphagoddess23
334,988454899586396160,5af88ac724c1c400cc54df5b,2018-04-23 18:29:47,,False,False,,1,0,0,My  nose  has been so  stuffed  and my  throat  hurts and I have a  headache . I’ve been eating so much spicy food hoping it’ll clear things up ,/_mack21_/status/988454899586396160,869612296393412609,_mack21_
335,988454612792262657,5af88ac724c1c400cc54df5c,2018-04-23 18:28:38,,False,False,,0,0,0,Also can’t tell if I’m getting better or worse. The cough and  sore   throat  are gone but  runny   nose  and mild fevers still around ,/_kiaaki/status/988454612792262657,741753680869789697,_kiaaki
336,988453419403960323,5af88ac724c1c400cc54df5d,2018-04-23 18:23:54,,False,False,,2,1,0,day 967. still sick. i have lost my sense of smell and taste. i can no longer breathe from my  nose .  throat  swollen from  coughing . talking has become difficult.,/woojinpeach/status/988453419403960323,833788661510533120,woojinpeach
337,988450728946610177,5af88ac724c1c400cc54df5e,2018-04-23 18:13:12,,False,False,,0,0,0,"How do I know if I’ve got a cold or hay  fever ? Never had hay  fever  before. Have swollen  throat , cough,  runny   nose , woolly head",/Beteenus/status/988450728946610177,214041527,Beteenus
338,988449344620781568,5af88ac724c1c400cc54df5f,2018-04-23 18:07:42,,False,False,,1,1,3,"My allergies are kicking my butt... literally I might tweet this everyday because my eyes burn, my  nose  feels like it’s going to bleed, I keep  sneezing , my  throat  itches constantly, and my ears itch too ",/Krissyyy__/status/988449344620781568,323585238,Krissyyy__
339,988447538926714880,5af88ac724c1c400cc54df60,2018-04-23 18:00:32,,False,False,,0,0,0,okay so my  throat  barely hurts and my  nose  is a bit  runny  but i feel like dying,/emiliannatt/status/988447538926714880,1944463471,emiliannatt
340,988437595079303170,5af88ac924c1c400cc54df61,2018-04-23 17:21:01,,False,False,,3,0,4,"Boiron's Sabadil temporarily relieves one or more of these symptoms of #hayfever  or other upper respiratory #allergies : itchy and watery eyes,  sneezing ,  runny   nose , and itchy  throat  and  nose .  http:// bit.ly/2Hbqh9R   pic.twitter.com/1JEvVe1Kkj",/BoironUSA/status/988437595079303170,43492105,BoironUSA
341,988435858247307264,5af88ac924c1c400cc54df62,2018-04-23 17:14:07,,False,False,,1,1,0,"That medicine worked like a charm. No  sneezing ,  coughing ,  runny   nose , itchy  throat , itchy tongue. Etc",/lolachantell_/status/988435858247307264,38099714,lolachantell_
342,988434716142505986,5af88ac924c1c400cc54df63,2018-04-23 17:09:35,,False,False,,2,0,0,"Less serious side effects may include: cold symptoms such as stuffy  nose ,  sneezing ,  sore   throat ; drowsiness, dizziness, feeling nervous; mild nausea, upset stomach, constipation;  pic.twitter.com/wQLjuoNSA6",/Camc96/status/988434716142505986,348021910,Camc96
343,988426475769663490,5af88ac924c1c400cc54df64,2018-04-23 16:36:50,,False,False,,0,0,0,Slept with the fan on last night Plus momma had the air on.. I wake up & now I gotta  sore   throat  & a  runny   nose  & this rain is definitely not helping,/__alexia_denise/status/988426475769663490,3050462325,__alexia_denise
344,988408444926427137,5af88ac924c1c400cc54df65,2018-04-23 15:25:11,,False,False,,15,0,0,everyone i know who was sick just got over their sickness. the whole time i was like “yusss i am in the clear.”  and now..  throat  is scratchy and  nose  is  runny  ,/pup_lo/status/988408444926427137,3184613906,pup_lo
345,988366269681487872,5af88ac924c1c400cc54df66,2018-04-23 12:37:36,,True,False,,1,1,0,"Why is everyone getting sick now ... Ive been sick since Saturday but havent thrown up at least not yet  coughing ,  sneezing  a lot, stuffy  nose , and  throat  been hurting shit dude feel better homie",/Zequas/status/988366269681487872,4564383612,Zequas
346,988344202110099456,5af88ac924c1c400cc54df67,2018-04-23 11:09:54,,False,False,,1,0,0,Morning all I've just started to get my first batch of people who are suffering quite badly with hay  fever  and are having ear candles to help clear their ear  nose  and  throat . Don't forget ear candles are very effective in helping you cope with Hay  fever  symptoms,/HolisticEyes/status/988344202110099456,368522383,HolisticEyes
347,988335961338605569,5af88ac924c1c400cc54df68,2018-04-23 10:37:10,,False,False,,0,0,0,"sore   throat  was cancelled,  runny   nose  comes to take over fuck..",/hangsangwithJHS/status/988335961338605569,946110585132916736,hangsangwithJHS
348,988313430875521024,5af88ac924c1c400cc54df69,2018-04-23 09:07:38,,False,False,,2,2,0,Oh my god I’m fuckin sick and in the past hour I felt my health: deteriorate n now I have a  stuffed   nose  and  sore   throat  n my  headache  is getting Worse and my legs r cramping just End It  pic.twitter.com/JDrKLU8P05,/pinkihyungwon/status/988313430875521024,777897420042608642,pinkihyungwon
349,988309589861924865,5af88ac924c1c400cc54df6a,2018-04-23 08:52:22,,False,False,,0,0,0,Headache .  Sore   throat . Blocking  nose .,/Larababe98/status/988309589861924865,618832033,Larababe98
350,988300957443276800,5af88ac924c1c400cc54df6b,2018-04-23 08:18:04,,False,False,,3,0,0,No bitch no empiezes. I have a  runny   nose  and my  throat  hurts. I swear if I get sick before prom I’m fighting someone,/jackiexchavz/status/988300957443276800,3280740614,jackiexchavz
351,988292149606203393,5af88ac924c1c400cc54df6c,2018-04-23 07:43:04,,False,False,,0,0,0,it's hurts to swallow and talk and the congestion makes me wanna die and the  sneezing  hurts my  nose  and my head and my  throat  and i just wanna k*** m*****,/protectjen/status/988292149606203393,860622209672282112,protectjen
352,988269901356744704,5af88ac924c1c400cc54df6d,2018-04-23 06:14:40,,False,False,,0,0,0,Even a cup of morning coffee doesn’t help me to get rid of this cold * runny   nose * *sneeeeeeeeze* *and I still have  sore   throat  too* ,/xlarisaa/status/988269901356744704,37394006,xlarisaa
353,988263981281366022,5af88ac924c1c400cc54df6e,2018-04-23 05:51:08,,True,False,,0,0,0,"Its apparently something specific to whatever this stuff was, who knows. I’m not allergic to hardly anything either. But my airways are like I have asthma & my  throat  has felt “burned” all day. No  runny   nose , not like strep, very weird. No more for me. I’ll stay WAY back.",/sqlgirl/status/988263981281366022,15568439,sqlgirl
354,988263751894872064,5af88ac924c1c400cc54df6f,2018-04-23 05:50:14,,True,False,,0,1,0,Runny   nose  and eyes. Constant  sneezing . Itchy  throat . Itchy eyes.,/ceetayy_/status/988263751894872064,72224100,ceetayy_
355,988263677227921408,5af88ac924c1c400cc54df70,2018-04-23 05:49:56,,False,False,,0,0,0,allergies really ON MY ASS .  -  sore   throat   -  coughing   - stuffy  nose   -  headache,/chxrdae/status/988263677227921408,950871238267850752,chxrdae
356,988256448231636992,5af88ac924c1c400cc54df71,2018-04-23 05:21:12,,False,False,,0,0,0,"my eyes r itchy n watery, i cant breathe out of my  nose  w/o leaking, my  throat  BURNS, i keep  sneezing , my coughs sound like i have bronchitis, and my vision is constantly cloudy  LOVE being sick",/flnnquaker/status/988256448231636992,777574286999457792,flnnquaker
357,988255803047006208,5af88ac924c1c400cc54df72,2018-04-23 05:18:39,,False,False,,0,0,0,"I have a  fever , sore   throat  & a  runny   nose  & I can’t wait to go home and sleep. S/o to all the guest who have been comming in & being patient and so sweet to me one even went out and got me cough drops ",/carmenpaolaaa/status/988255803047006208,793261840004358145,carmenpaolaaa
358,988255090418110464,5af88ac924c1c400cc54df73,2018-04-23 05:15:49,,False,False,,0,0,0,"it’d be ok if it was like,  runny   nose  allergies but my  throat  just fucking hurts like hell",/clombinator/status/988255090418110464,2446088065,clombinator
359,988242625231753223,5af88ac924c1c400cc54df74,2018-04-23 04:26:17,,False,False,,6,1,0,runny   nose .  sore   throat . headaches.  fever . all of this pain. but nothing compares how much a miss Daniel rn.   @SeaveyDaniel,/jenerousjoey/status/988242625231753223,1108079988,jenerousjoey
360,988227513947172864,5af88aca24c1c400cc54df75,2018-04-23 03:26:14,,False,False,,0,0,0,"as soon as i get over my cold and  sore   throat , BOOM, i get hit with pink eye & a  runny   nose   . this has been like the best/worst two weeks of my entire year.",/rza_thegenie/status/988227513947172864,476020413,rza_thegenie
361,988226537743728640,5af88aca24c1c400cc54df76,2018-04-23 03:22:21,,False,False,,0,0,0,I’m sad and I have a  runny   nose  and I think I’m gonna have a  sore   throat     https:// twitter.com/kaqong/status/ 988226407992967168   …,/ysmkaq/status/988226537743728640,769503362014294017,ysmkaq
362,988219505749839872,5af88aca24c1c400cc54df77,2018-04-23 02:54:25,,False,False,,0,0,0,Still going to work even though my  throat  is dying ft my  runny   nose    being adult sucks,/minbaekgu/status/988219505749839872,380742870,minbaekgu
363,988219317773832192,5af88aca24c1c400cc54df78,2018-04-23 02:53:40,,False,False,,1,1,0,and the health center is closed on the weekends so now i get to see what kind of fucking tree gave me this cloudy head and  sore   throat  and  runny   nose  and puffy eyes tomorrow,/kyotowinds/status/988219317773832192,862481387496099841,kyotowinds
364,988214216552263680,5af88aca24c1c400cc54df79,2018-04-23 02:33:24,,False,False,,0,0,0,"teary and itchy eyes,  runny  and stuffy and itchy  nose  and itchy and blocked  throat   pic.twitter.com/N9y02jcIky",/ohthatkidyna_/status/988214216552263680,2582874973,ohthatkidyna_
365,988207824617574401,5af88aca24c1c400cc54df7a,2018-04-23 02:08:00,,False,False,,1,1,0,Sore   throat  gone. But now i can't breathe properly through my  nose  and i'm  sneezing  alot :')  pic.twitter.com/Dq7py5B9r5,/kerri_twt/status/988207824617574401,4906148817,kerri_twt
366,988202739325747200,5af88aca24c1c400cc54df7b,2018-04-23 01:47:47,,False,False,,0,0,0,SPRINGTIME IS HERE WHICH MEANS IT'S TIME FOR.... PROM? FINALS? LOVEY TIMES? RAIN? NOCK KNOCK iTS YOUR FRIENDLY NEIGHBOUR A L L E R G I E S with Mrs. PAINFULLY ITCHY  THROAT  and Mrs.  rUNnY   NOSE  and tHEIR KID ITCHY EYES WOW I LOVE SPRING,/BowtieKaytie/status/988202739325747200,810386836547899392,BowtieKaytie
367,988202631368757248,5af88aca24c1c400cc54df7c,2018-04-23 01:47:21,,False,False,,0,0,0,i have a small cold and it sucks because i work a lot of long days this week :( though im hoping it's one of those T Colds and my voice is deeper after this  i think it might be because my  throat  started out really itchy for a few days and now i have a  runny   nose  so hmm,/kind7ed/status/988202631368757248,2298938742,kind7ed
368,988201159289720832,5af88aca24c1c400cc54df7d,2018-04-23 01:41:30,,True,False,,0,0,0,Yeah she had a  runny   nose  yesterday and we thought it was allergies until I woke up with a  sore   throat  this morning,/matt_barlowe/status/988201159289720832,759567677539180544,matt_barlowe
369,988197436765110273,5af88aca24c1c400cc54df7e,2018-04-23 01:26:43,,False,False,,0,0,0,my  throat  has been hurting All day and my  nose  is  runny  i swear to fuck if i am getting sick i will CRY,/iIuvhwaII/status/988197436765110273,826226231796457472,iIuvhwaII
370,988196659837489152,5af88aca24c1c400cc54df7f,2018-04-23 01:23:38,,False,False,,7,0,1,"I mean I don’t even know what the worst part of hay  fever  is. The watery, itchy eyes that swell into blobs of red jelly. The itchy, sniffly  nose  that just does not stop. The unbearably itchy  throat  that I literally wanna scratch with a fork until I bleed. The ears. Fuck pollen.",/jodiebryars/status/988196659837489152,535869537,jodiebryars
371,988179524172107776,5af88aca24c1c400cc54df80,2018-04-23 00:15:32,,False,False,,1,0,0,My  throat  hurts n i have a  runny   nose  ,/lucidsailor/status/988179524172107776,111487868,lucidsailor
372,988171109475368961,5af88aca24c1c400cc54df81,2018-04-22 23:42:06,,False,False,,3,0,0,"FUCK ALLERGIES!!! My allergies this year is the worst. My  throat  is itchy af let’s add that to my  runny  eyes,  nose ,  sneezing , itchy eyes. FML ",/franpcolina/status/988171109475368961,4712507803,franpcolina
373,988157001611046913,5af88aca24c1c400cc54df82,2018-04-22 22:46:02,,False,False,,1,0,0,"It sucks having allergies. Like I wake up with a  runny   nose , itchy eyes/ throat , and I’m wheezing. Like what is really going on!!",/Hadidee_/status/988157001611046913,3217116740,Hadidee_
374,988123254324908034,5af88aca24c1c400cc54df83,2018-04-22 20:31:56,,False,False,,1,1,0,"Trying to nod off but my blocked  nose ,  sore   throat  and  fever  isn’t having it. :/  pic.twitter.com/7K1Yvo1dAs",/Curiousfaz/status/988123254324908034,987389303419531265,Curiousfaz
375,988121352447188992,5af88aca24c1c400cc54df84,2018-04-22 20:24:23,,False,False,,0,0,1,"Everyone in this house has had the  flu  for like a week and I think I'm getting it. Woke up with a  sore   throat , stuffy  nose  and a  headache  today ",/SandaMat/status/988121352447188992,493531619,SandaMat
376,988119939407142912,5af88aca24c1c400cc54df85,2018-04-22 20:18:46,,True,False,,1,1,0,Girl same.   woke up this morning with a  sore   throat   headache  and stuffy  nose .,/SaamBrookss/status/988119939407142912,594939082,SaamBrookss
377,988118395575992320,5af88aca24c1c400cc54df86,2018-04-22 20:12:38,,False,False,,0,0,0,"Wow, anyone got any tips on quick ways to recover from  flu  like germs? I'm bedridden with a temperature that doesn't come down with painkillers, streaming  nose , horrid cough,  sore   throat , earache and aching body. Feel ROUGH. Willing to try anything..... #flu  #medicine  #help",/nikki_greenall/status/988118395575992320,4096691008,nikki_greenall
378,988115706272145408,5af88aca24c1c400cc54df87,2018-04-22 20:01:57,,False,False,,0,0,1,Sore   throat  and  runny   nose  won’t keep me from enjoying my Sunday #LATimesFestivalOfBooks  @LAPublicLibrary  @latimesfob pic.twitter.com/eV1q8HyKpq,/ibprizzlybear/status/988115706272145408,3304410889,ibprizzlybear
379,988115479821565952,5af88aca24c1c400cc54df88,2018-04-22 20:01:03,,False,False,,1,0,0,"My Mood Update: Oblivious Friend- “How is your day going?” Me- “My  nose  is stuffy, my  throat  hurts, I have a  headache , and my stomach hates me...how do you think my day is going?” Oblivious Friend- “...bad?” Me- “NO SHIT!”",/IAmMusicIsMe/status/988115479821565952,864156421373513728,IAmMusicIsMe
380,988115229459599361,5af88acb24c1c400cc54df89,2018-04-22 20:00:03,,False,False,,93,8,8,"Who’s excited to experience clarity from miserable allergy symptoms for up to 8 hours? @cleargeneration  Allergy Relief provides relief from  sneezing ,  runny   nose , itchy, watery eyes, itchy  nose  and  throat  and cough. #EarthDay pic.twitter.com/kA8RK45dGf",/pinchme/status/988115229459599361,872983796,pinchme
381,988114968292876289,5af88acb24c1c400cc54df8a,2018-04-22 19:59:01,,False,False,,1,0,1,"Love #Oscillo  for flu-like symptoms? Then you'll like Coldcalm for  sneezing ,  runny   nose  & minor  sore   throat .  http:// bit.ly/241tRJw   pic.twitter.com/W2HQJcWxZJ",/OscilloUSA/status/988114968292876289,17876394,OscilloUSA
382,988113053043625984,5af88acb24c1c400cc54df8b,2018-04-22 19:51:24,,False,False,,0,0,0,"how tf do I wake up with a  sore   throat , ear ache and  runny   nose ? ",/CruzMercades/status/988113053043625984,870165938,CruzMercades
383,988107789225558016,5af88acb24c1c400cc54df8c,2018-04-22 19:30:29,,False,False,,1,0,0,"I can FEEL the pollen in the air, hayfever has begun, I was complaining about the cold, but I take it all back, I’d rather freeze to death than suffer these allergies, its the eyes that does it, I can take the  sore   throat , the blocked  nose , the  sneezing , just not the eyes.",/MidoriNoHonoo/status/988107789225558016,3926485876,MidoriNoHonoo
384,988103633265987584,5af88acb24c1c400cc54df8d,2018-04-22 19:13:58,,False,False,,0,0,0,"@ DillonnLee  needs to come home. I’m falling apart without him.  Sore   throat ,  runny   nose , cough & now pinkeye. ",/RaeAnnRuth16/status/988103633265987584,819918824,RaeAnnRuth16
385,988094153140686848,5af88acb24c1c400cc54df8e,2018-04-22 18:36:18,True,False,False,['https://t.co/kJLPAIcW5r'],0,0,0,"Runny   nose ,  sneezing ,  coughing ,  sore   throat  and it won't get better? It could be mold in your home:  http:// goo.gl/HrQwha  ",/moldadvisor/status/988094153140686848,2427203222,moldadvisor
386,988091871376363527,5af88acb24c1c400cc54df8f,2018-04-22 18:27:14,,False,False,,0,0,0,"I have a  sore   throat ,  runny   nose  and congestion. I'm starting to love one of my work millennials a teeny bit less. He knows who he is ...",/NancyClanton/status/988091871376363527,450236439,NancyClanton
387,988083856061485056,5af88acb24c1c400cc54df90,2018-04-22 17:55:23,,False,False,,9,5,0,"Man dude I got a  runny   nose ,  throat  feels like it's getting real  sore  & constant  headache , I feel like shit. Does anyone have any good remedies???",/CuriousNesska/status/988083856061485056,2962244635,CuriousNesska
388,988073066956771328,5af88acb24c1c400cc54df91,2018-04-22 17:12:31,,False,False,,1,0,0,"Everyone out there having amazing sunday in swimsuits and I'm here , with clogged  nose ,  headache ,  sore   throat  and my mouth is dry so I drink every ten seconds and toilet is my second home.  pic.twitter.com/cLIOccCXAf",/VeronicaPavlech/status/988073066956771328,885180410182979584,VeronicaPavlech
389,988071695763296256,5af88acb24c1c400cc54df92,2018-04-22 17:07:04,,False,False,,2,1,0,"Very  runny   nose ,  Sore   throat , And Cough.  R.i.p.",/RBM5Studios/status/988071695763296256,776624850940997632,RBM5Studios
390,988070937714028544,5af88acb24c1c400cc54df93,2018-04-22 17:04:03,,False,False,,0,0,0,Runny   nose +  sore   throat  + some inflammation at my conjunctiva ,/farrahanima/status/988070937714028544,90799038,farrahanima
391,988061661004226561,5af88acb24c1c400cc54df94,2018-04-22 16:27:11,,True,False,,0,0,0,Nice but dangerous. The twmperature drops so quickly and catches you off-guard. Tomorrow morning you'll have a  runny   nose  and scratchy  throat,/TauYaDitshego/status/988061661004226561,301607275,TauYaDitshego
392,988052648183062528,5af88acb24c1c400cc54df95,2018-04-22 15:51:23,,False,False,,0,1,0,Im not hating any smokers tho btw! Im okay with it cause I literally sit beside my siblings when they smoke.. but im not okay when the smell of smoke hit my  nose  when im recovering from a minor  flu /cold!!!!! Especially when i have A FUCKING  SORE   THROAT !!!!,/angelynwilsonn/status/988052648183062528,1042566030,angelynwilsonn
393,988028427549728770,5af88acb24c1c400cc54df96,2018-04-22 14:15:08,,False,False,,0,0,0,A  runny   nose  and itchy  throat  on this lovely day. Getting a honey and lemon locket.,/alan_simms/status/988028427549728770,492299966,alan_simms
394,988012739753906176,5af88acb24c1c400cc54df97,2018-04-22 13:12:48,,False,False,,0,0,0,"Sorry for all the retweets, but there's just way to much good stuff on twitter this morning.  Anyways, good morning, hope you're all doing well.. Unlike me, who completely lost his voice and has a  stuffed   nose  and  throat ..  Flu  season is really getitng me this year, my god.. xD",/FoxYume/status/988012739753906176,1615577270,FoxYume
395,988009788901548032,5af88acb24c1c400cc54df98,2018-04-22 13:01:04,,False,False,,0,0,0,sore   throat  and  runny   nose  ,/ajtongko/status/988009788901548032,703380169,ajtongko
396,988002044706545664,5af88acb24c1c400cc54df99,2018-04-22 12:30:18,,False,False,,2,1,0,"Waking up with a  sore   throat  and a  stuffed / runny   nose . Awesome, super bummed out right now i cant be sick. I have work i gotta do. #HasACold  #Upset",/Sorrel_Pandoth/status/988002044706545664,3021563314,Sorrel_Pandoth
397,987999033783336961,5af88acb24c1c400cc54df9a,2018-04-22 12:18:20,,False,False,,0,0,0,Hv  runny   nose  since last night and now my  throat  start aching. ,/ejanPaejan_/status/987999033783336961,352743146,ejanPaejan_
398,987995131545640960,5af88acb24c1c400cc54df9b,2018-04-22 12:02:50,,False,False,,1,0,0,Woke up to a  runny /stuffy  nose  and a  sore   throat .    Spring why must you hurt me with the seasonal allergies? Ugh!,/Aimz2424/status/987995131545640960,3112072501,Aimz2424
399,987986961515229184,5af88acb24c1c400cc54df9c,2018-04-22 11:30:22,,False,False,,1,0,0,cant stop  sneezing  my  throat  burns and my  nose  is congested all signs of a cold i will 100% k*ll m*self tomorrow,/eIizatayIrs/status/987986961515229184,2828920927,eIizatayIrs
400,987976447296815105,5af88acc24c1c400cc54df9d,2018-04-22 10:48:35,,False,False,,0,0,0,"Allegra Allergy 12hr Tablets 12 ct relieves symptoms associated with hay  fever  and allergies, including sinus pressure,  runny   nose , itchy and watery eyes, itchy  nose  or  throat , and  sneezing . Available at $9.59. Use code ""intro"" for free shipping.  http://www. deals2otc.com/allegra-allerg y-12hr-tablets-12ct.html   … pic.twitter.com/AlCRlDCIGO",/deals2otc/status/987976447296815105,735412750080413696,deals2otc
401,987968033867030528,5af88acc24c1c400cc54df9e,2018-04-22 10:15:09,,False,False,,0,1,0,Goddamn my  nose  is so  runny  and  throat  so itchy. Tylenol do ur thing I need to be healthy this week,/GDiddyPurp/status/987968033867030528,864596232,GDiddyPurp
402,987967248093532161,5af88acc24c1c400cc54df9f,2018-04-22 10:12:02,,False,False,,0,0,0,itchy  throat  and  runny   nose,/krizelarevalo_/status/987967248093532161,297263970,krizelarevalo_
403,987952717967642624,5af88acc24c1c400cc54dfa0,2018-04-22 09:14:17,,False,False,,0,0,0,I have a cold I have a  headache  My  nose  is hurting My  throat  is itching & most of all ... I miss my fine ass boyfriend ,/damngalyoufine/status/987952717967642624,1290938288,damngalyoufine
404,987951341371703297,5af88acc24c1c400cc54dfa1,2018-04-22 09:08:49,,False,False,,0,0,0,"Down with  fever    and  sore   throat , blocked  nose   runny   nose . Bored of staying in all day. But also tired to go out ",/ZullyWully/status/987951341371703297,46925894,ZullyWully
405,987896247041363970,5af88acc24c1c400cc54dfa2,2018-04-22 05:29:54,,False,False,,1,0,0,"Got on cam earlier & felt fine but then I got really cold & started feeling like I was gettin sick so I signed off.. as the night went on, it’s now official I’m sick! My  nose  is so itchy, stuffy &  runny  plus the back of my  throat ’s itchy! Best this happens now and not on vacation",/KayBunzz/status/987896247041363970,1687156392,KayBunzz
406,987886990917021696,5af88acc24c1c400cc54dfa3,2018-04-22 04:53:07,,False,False,,0,0,0,When it's not about left eye crying... it's about right eye crying... or both. When it's not about  sneezing  like crazy it's about itches in the  nose . When it's not about a weird feeling in my  throat  it's about a lil hard time breathing.  Spring is taking advantage.  pic.twitter.com/wQlzWOmVsB,/Celticmoorish/status/987886990917021696,81164869,Celticmoorish
407,987881589097938944,5af88acc24c1c400cc54dfa4,2018-04-22 04:31:39,,False,False,,0,1,0,"waking up with a  headache ,  sore   throat ,  runny   nose , and bodyache is a missery",/interostellar/status/987881589097938944,560188354,interostellar
408,987880158051913728,5af88acc24c1c400cc54dfa5,2018-04-22 04:25:58,,False,False,,0,0,0,"woke up w/ a  headache ,  runny   nose , watery eyes, not to mention they’re burning & a  sore   throat .",/ayyejenn/status/987880158051913728,363378195,ayyejenn
409,987852758488371202,5af88acc24c1c400cc54dfa6,2018-04-22 02:37:05,,False,False,,0,0,0,"God, I feel like I'm about to die  My  throat  is in alot of pain, my  nose  is extremely stuffy, and when I cough my  throat  hurts more and my cheekbones have started to hurt from  coughing  so hard",/CeledonianError/status/987852758488371202,949500854750588928,CeledonianError
410,987843323376254977,5af88acc24c1c400cc54dfa7,2018-04-22 01:59:36,,False,False,,1,6,1,"This is the strangest  flu .   Tues:  sore   throat  Wed:  sore   throat  & body aches Thurs:  sore   throat  Fri:  sore   throat  & sudden sinus pressure.  Sat:  sore   throat ,  stuffed  up, massive  headache .  pic.twitter.com/lBiWnz2wZG",/IsobelCarr/status/987843323376254977,271676493,IsobelCarr
411,987830718913904641,5af88acc24c1c400cc54dfa8,2018-04-22 01:09:31,,False,False,,2,2,0,"Woke up with a muscle pull on my right calf, a stomach ache, a  sore   throat , a slight  fever  and a blocked  nose .   May these sickness help lessen my sins. In shaa Allah.",/dbmr_/status/987830718913904641,2785769432,dbmr_
412,987830179337650176,5af88acc24c1c400cc54dfa9,2018-04-22 01:07:22,,False,False,,1,0,0,"# rowingmachine  time 5min, 153 rows. That was rough. I'm sick with a  sore   throat ,  runny   nose , possibly due to allergies, and I'm feeling it now. I had to pause at 99. I'm going to skip the 10 minute set and Wii Fit exercises, rest up, and hopefully feel better tomorrow.  pic.twitter.com/cUFnNXPz5E",/BetterZombie/status/987830179337650176,829492803520507908,BetterZombie
413,987798357417512960,5af88acc24c1c400cc54dfaa,2018-04-21 23:00:55,,True,False,,0,1,0,Sore   throat  and  runny   nose,/Seithis_M/status/987798357417512960,926948746276958209,Seithis_M
