,ID,_id,datetime,has_media,is_reply,is_retweet,medias,nbr_favorite,nbr_reply,nbr_retweet,text,url,user_id,usernameTweet
748,985500928244572160,5af88ae124c1c400cc54e0f9,2018-04-15 14:51:45,,False,False,,0,0,0,"Take as needed for  headache ,  sore   throat ,  runny   nose , congestion. “Mission Accomplished” is not the same as cold medicine.  https:// twitter.com/realdonaldtrum p/status/985492862958698497   …",/TracyRenee10/status/985500928244572160,1282256192,TracyRenee10
749,985491774725500928,5af88ae124c1c400cc54e0fa,2018-04-15 14:15:23,,False,False,,2,1,0,no more  sore   throat  and  runny   nose  pero may  sore  eyes naman na ako??????? ;((,/kerelrazonable/status/985491774725500928,2323500684,kerelrazonable
750,985481870111424512,5af88ae124c1c400cc54e0fb,2018-04-15 13:36:01,,True,False,,0,1,0,"The bitter liquid that was dripping from his mouth was thick and dark in color, it was scentless, yet Yunfan's sensitive  nose  could smell a distinct scent of his blood came out from the liquid. He was still  coughing  up of it, his  throat  was burning, and his strength was ↷",/DuxRegius/status/985481870111424512,707064184505114624,DuxRegius
751,985452349903618048,5af88ae124c1c400cc54e0fc,2018-04-15 11:38:43,,True,False,,1,0,0,"OH BOY. I thought you meant emotional. :^/ get well soon!! I had a  flu  for over a week it messed with my  throat / nose , I sympathise",/pat_roclus/status/985452349903618048,897241246405509120,pat_roclus
752,985450244400824321,5af88ae124c1c400cc54e0fd,2018-04-15 11:30:21,,False,False,,0,1,0,hell or assignments +  runny   nose  +  sore   throat  = perfect weekend,/Jokerbest/status/985450244400824321,182409531,Jokerbest
753,985446430243508229,5af88ae124c1c400cc54e0fe,2018-04-15 11:15:12,,False,False,,0,0,0,"It funny how one performance can give you 1.)  Sore   Throat  2.) Busted Kneecaps  3.)  Runny   Nose  4.) Wet, Sweaty Clothes 5.) Sleepless Nights  #COCHELLA  #BEYCHELLA",/_21ctate_/status/985446430243508229,761683361077178368,_21ctate_
754,985445328097894400,5af88ae124c1c400cc54e0ff,2018-04-15 11:10:49,,True,False,,1,1,0,"Hi, I had s  sore   throat  and  runny   nose  yesterday. The  runny   nose  has stopped today, but the  sore   throat  persists :( I've got an appointment for a surgical extraction of a tooth tomorrow, I hope this doesn't affect that.",/ThatGuyAkshay/status/985445328097894400,945015660475797506,ThatGuyAkshay
755,985438070798536704,5af88ae124c1c400cc54e100,2018-04-15 10:41:59,,False,False,,0,1,0,"I /REALLY/ hate being sick. This is the second time since 2018 started that Ive had a  fever , bloody  nose , congestion,  sore   throat , cough, & ears being plugged up. Id say least my eardrum cant rupture AGAIN but now that it already is if I get an ear infection my brain is in danger",/klutzyZombie/status/985438070798536704,4441152448,klutzyZombie
756,985436883273445380,5af88ae124c1c400cc54e101,2018-04-15 10:37:16,,False,False,,0,0,0,"clogged/non stop  runny   nose ,  sore   throat ,  headache ,  fever  all at once out of no where",/kjaybombay/status/985436883273445380,2437550730,kjaybombay
757,985433661150564352,5af88ae224c1c400cc54e102,2018-04-15 10:24:27,,False,False,,3,1,1,"I woke up with a  sore   throat  and a  runny   nose , great.  pic.twitter.com/QVcTr7mTwv",/LHSHIP/status/985433661150564352,2887562848,LHSHIP
758,985384488204144641,5af88ae224c1c400cc54e103,2018-04-15 07:09:04,,False,False,,0,1,0,"Runny   nose , cough and  sore   throat . Like why life whyyyy ",/haneenoz66/status/985384488204144641,2200039695,haneenoz66
759,985375239251963904,5af88ae224c1c400cc54e104,2018-04-15 06:32:19,,False,False,,1,0,0,"Sore   throat , slight  headache  and  runny   nose  so i guess  fever  it is ",/faratini5/status/985375239251963904,1559783724,faratini5
760,985362098967465984,5af88ae224c1c400cc54e105,2018-04-15 05:40:06,,True,False,,1,0,0,it can make you have a  runny   nose  and a  sore   throat  for a day or two :-(,/eclipsedpml/status/985362098967465984,940404836046077952,eclipsedpml
761,985361031173111808,5af88ae224c1c400cc54e106,2018-04-15 05:35:51,,False,False,,2,0,0,I have such a  runny   nose  and I can’t stand my  throat  ugh,/jiminsglory/status/985361031173111808,921025815655211015,jiminsglory
762,985332310261121024,5af88ae224c1c400cc54e107,2018-04-15 03:41:44,,False,False,,0,0,0,"Drank Pepsi, which has somehow become a rare occurrence. I'm making a conscious effort to cut down soft drink. Anyway, after drinking it now my  nose  is  runny , my  throat  is full of phlegm.",/Nyzms/status/985332310261121024,21188789,Nyzms
763,985317777043996673,5af88ae224c1c400cc54e108,2018-04-15 02:43:59,,False,False,,6,0,0,Now that my  sore   throat  is pretty much gone the stuffiness and  runny   nose  have come to take its place I’m dyin Scoob  pic.twitter.com/E0bjTWJ2mr,/Chromcake/status/985317777043996673,2382842245,Chromcake
764,985301224076423168,5af88ae224c1c400cc54e109,2018-04-15 01:38:12,,False,False,,4,1,0,"So, I woke up with: a  sore   throat , blocked/ runny   nose , and a  headache . And I have to work all day today and tomorrow because I’m the supervisor ",/amethystroadx/status/985301224076423168,872754758087344128,amethystroadx
765,985285722386190336,5af88ae224c1c400cc54e10a,2018-04-15 00:36:36,,False,False,,1,0,0,There's a fire somewhere and there's a ton of smoke everywhere because of all the wind and I can't stop  coughing  because its burning my  nose  and  throat,/Cypher_Hoe/status/985285722386190336,766208449558482944,Cypher_Hoe
766,985269546604023808,5af88ae224c1c400cc54e10b,2018-04-14 23:32:19,,False,False,,0,0,0,Had a burning  sore   throat  and now downgraded to stuffy and  runny   nose . Would've recovered better if I didn't feel like shit before.,/JamilaAD/status/985269546604023808,54286100,JamilaAD
767,985266343556669447,5af88ae224c1c400cc54e10c,2018-04-14 23:19:36,,False,False,,1,0,0,"my whole face is gross, my  nose  is stuffy, my eyes are getting puffy, i keep  sneezing , my  throat  itches,,, so seeing GOOD CONTENT IS MAKING ME HAPPY",/alibeanzz/status/985266343556669447,923953448084824064,alibeanzz
768,985265640264077312,5af88ae224c1c400cc54e10d,2018-04-14 23:16:48,,False,False,,0,0,0,I woke up with a  headache  & my  throat / nose  itching,/LeontaeMichelle/status/985265640264077312,232060977,LeontaeMichelle
769,985252352713265152,5af88ae224c1c400cc54e10e,2018-04-14 22:24:00,,False,False,,0,0,0,makes tea bc my  nose  and  throat  are killing me ahfkljshfjasf and it's rainin g and i got a  headache .. not a great day,/shineonthesea/status/985252352713265152,1654247118,shineonthesea
770,985246926076567553,5af88ae224c1c400cc54e10f,2018-04-14 22:02:26,,False,False,,0,1,0,My  throat  hurts  Head pounding Eyes teary   Nose  running  The  flu  is the death of me. ,/Busi_Shai/status/985246926076567553,4872810645,Busi_Shai
771,985244462162071552,5af88ae224c1c400cc54e110,2018-04-14 21:52:39,,False,False,,1,1,0,i have a  runny   nose  and a  sore   throat  ugh i feel so horrible  pic.twitter.com/ybWV66O4gp,/singularityxtae/status/985244462162071552,823009445395517440,singularityxtae
772,985237382239842304,5af88ae224c1c400cc54e111,2018-04-14 21:24:31,,False,False,,1,1,0,Ayooo so I’m her with my girl they did a  throat  swab and they took some liquid out from her  nose  to test for the  flu . I’ve never seen nothing like it,/sliimshadyyyy/status/985237382239842304,455484644,sliimshadyyyy
773,985211344440848384,5af88ae224c1c400cc54e112,2018-04-14 19:41:03,,False,False,,0,0,0,"Blocked  nose , check.  Fever , check. Swollen eyes, check.  Sore   throat , check. Heavy chest, check. Dying, check.",/dwptrprtw/status/985211344440848384,99929419,dwptrprtw
774,985203991540711424,5af88ae224c1c400cc54e113,2018-04-14 19:11:50,,False,False,,1,1,0,"ya girl sick with a  sore   throat ,  runny   nose ,  fever , and migraine but i’m still gonna go out and do makeup today and get this MONEY ",/gbymeyer/status/985203991540711424,788978548849594372,gbymeyer
775,985201139871309825,5af88ae224c1c400cc54e114,2018-04-14 19:00:30,,False,False,,0,0,0,"my  headache  on 189000,  throat   sore  af, & can’t breathe out my  nose    I just wanna be babied.",/yannnnac/status/985201139871309825,1123771610,yannnnac
776,985198684869677056,5af88ae224c1c400cc54e115,2018-04-14 18:50:45,,False,False,,0,0,0,"Blech, getting a  runny   nose  now as well. At least my  throat  is feeling slightly better. Not in the mood to get sick.",/ASliceofFredrik/status/985198684869677056,1912419985,ASliceofFredrik
777,985189536308195328,5af88ae324c1c400cc54e116,2018-04-14 18:14:24,,False,False,,0,0,0,Throat  is hurting.  Runny   nose .,/nurulfatehah95/status/985189536308195328,208509021,nurulfatehah95
778,985189235933175809,5af88ae324c1c400cc54e117,2018-04-14 18:13:12,,True,False,,0,1,0,my  nose  start to get  runny  just now i might wake up have a  sore   throat  or smtg since these days malaysia is so hot   but its not that bad uwu dont worry,/euijinasty/status/985189235933175809,447756689,euijinasty
779,985178176497377285,5af88ae324c1c400cc54e118,2018-04-14 17:29:15,,False,False,,0,0,0,"My  throat  feels like it's on fire!  It's not strep, and I don't have a  fever /chills. I don't even have a  runny   nose  and cough to go with it.  Just a  sore , inflames, red and swollen  throat .  Come on! If you're going to make me sick, do it good and proper so others will believe me!",/Lamoreaux_R/status/985178176497377285,1250347657,Lamoreaux_R
780,985177584093814784,5af88ae324c1c400cc54e119,2018-04-14 17:26:54,,False,False,,1,0,1,"i have a wedding to photograph today, my back,  throat  and head hurts. my  nose  is  runny . challenge accepted! today i am going to make my best photographs thus far! #weddingphotographer",/adeoshodi_photo/status/985177584093814784,305571046,adeoshodi_photo
781,985176713368748032,5af88ae324c1c400cc54e11a,2018-04-14 17:23:26,,True,False,,0,0,0,"It’s terrible some how I managed to wakeup with a  sore   throat , a terrible cough my  nose  is  stuffed  I have a  fever  fuck me man lol",/kailsssz/status/985176713368748032,760894777248317440,kailsssz
782,985175928786575365,5af88ae324c1c400cc54e11b,2018-04-14 17:20:19,,False,False,,0,0,0,"I really enjoy  sneezing  all day, having itchy eyes, scratchy  throat , and stuffy  nose",/liarhyejeong/status/985175928786575365,887415306536308736,liarhyejeong
783,985164182818607104,5af88ae324c1c400cc54e11c,2018-04-14 16:33:39,,False,False,,1,1,0,"Woke up with a  sore   throat ,  runny   nose  and Oral Gynaecology exam tomorrow. Beat that ",/YaraAshraf10/status/985164182818607104,372231557,YaraAshraf10
784,985163176760283136,5af88ae324c1c400cc54e11d,2018-04-14 16:29:39,,False,False,,0,0,0,"Sore   throat , stuffy  nose ,  runny  eyes and dry cough. My sinus sending me down through there for real.",/Kruel_Kindness/status/985163176760283136,946364146563665920,Kruel_Kindness
785,985151773349265408,5af88ae324c1c400cc54e11e,2018-04-14 15:44:20,,False,False,,0,0,0,Feeling so fucking sick   i have the craziest  fever  going on and my  nose  is running along with my eyes all fucking puffy someone help me !!   my  throat  is itchy as fuck too i hate my coughs! #sicklife  #sick,/therealtalisa/status/985151773349265408,337308512,therealtalisa
786,985149197908197376,5af88ae324c1c400cc54e11f,2018-04-14 15:34:06,,False,False,,0,0,0,My  sore   throat  is p much gone but cough and  runny   nose  has come to find me  pic.twitter.com/sQXSFbFKfr,/hansangcute/status/985149197908197376,826837456808861696,hansangcute
787,985146685499338754,5af88ae324c1c400cc54e120,2018-04-14 15:24:07,,False,False,,0,0,0,Eyes watering   Nose  running   Throat  itching  And  sneezing .  The morning life of me.,/Simply_Julienne/status/985146685499338754,601502525,Simply_Julienne
788,985144432356986880,5af88ae324c1c400cc54e121,2018-04-14 15:15:10,,False,False,,0,0,0,"Woke up without a hangover but I have a terrible  sore   throat ,  runny   nose , & achy body ",/NNAynattirb/status/985144432356986880,364487315,NNAynattirb
789,985142108767088648,5af88ae324c1c400cc54e122,2018-04-14 15:05:56,,True,False,,1,1,0,Nose  less  runny  than the other night... throat  all good,/lilpeaceofkrys/status/985142108767088648,822821753114267649,lilpeaceofkrys
790,985137931009576960,5af88ae324c1c400cc54e123,2018-04-14 14:49:20,,False,False,,3,0,0,"Been up since 7 with itchy eyes,  runny   nose ,  sneezing , itchy  throat . It has begun",/K_DubFresh/status/985137931009576960,35814330,K_DubFresh
791,985133066623619072,5af88ae324c1c400cc54e124,2018-04-14 14:30:00,True,False,False,['https://t.co/t0aVEhNaFs'],6,0,0,"When a chronic  runny   nose  could mean it's time to see an Ear,  Nose  and  Throat  Specialist.  http:// spr.ly/6016DZU2Q  ",/nationwidekids/status/985133066623619072,19916680,nationwidekids
792,985117984799821825,5af88ae324c1c400cc54e125,2018-04-14 13:30:04,,False,False,,4,0,0,"Health problems By Air Pollution Apart from irritation of eyes,  nose , mouth and  throat  or diminished energy levels,  headache  and dizziness, the severity of it extends and lung diseases, including: Asthma attacks, Chronic Obstructive Pulmonary Disease , Heart Attack, Brain Stroke.  pic.twitter.com/lmZNGlfyO1",/shudhvayu/status/985117984799821825,970913647437471745,shudhvayu
793,985091279229935616,5af88ae324c1c400cc54e126,2018-04-14 11:43:57,,False,False,,0,0,0,"Runny   nose ,  sore   throat ,  headache  are not a good combo.  Orang lain dalam rumah ni semua dah kena batuk demam semua. Ingatkan terselamat rupanya terkena jua ",/sofiaidris/status/985091279229935616,359937830,sofiaidris
794,985082263686836224,5af88ae324c1c400cc54e127,2018-04-14 11:08:08,,False,False,,0,0,0,"i’ve made a scientific discovery.  Throat  hurty,  nose   runny . I is sick.",/ReemaTheRoamer/status/985082263686836224,772916639264182272,ReemaTheRoamer
795,985078206146412545,5af88ae324c1c400cc54e128,2018-04-14 10:52:00,,False,False,,0,0,0,Only have a  runny   nose  and a  sore   throat  OH and I’m really hungry lol,/sleepiealiens/status/985078206146412545,702540889693003777,sleepiealiens
796,985054916572884995,5af88ae324c1c400cc54e129,2018-04-14 09:19:28,,False,False,,0,0,0,"sore   throat ,  runny   nose , non-stop  sneezing ,  headache . cant this day get any worst",/1frhfdzl/status/985054916572884995,429681195,1frhfdzl
797,985047445490028544,5af88ae524c1c400cc54e12a,2018-04-14 08:49:46,,True,False,,1,1,0,Proper shite ..  And On top of that ... I'm full  of germs who have started a fucking war in my body ..  sore   throat  a nasty cough blocked ears  runny   nose  tight chest ..  Some say it's just a cold .. I say it's too much of coincidence. .  Trump did this to me   lol,/Ebenezergood/status/985047445490028544,47703606,Ebenezergood
798,985033705201774593,5af88ae524c1c400cc54e12b,2018-04-14 07:55:11,,False,False,,1,0,0,"Runny   nose ,  sore   throat , resting heart rate elevated by 10bpm. Perfect timing! #maranoia",/runtoomuch/status/985033705201774593,317061693,runtoomuch
799,985011900009402368,5af88ae524c1c400cc54e12c,2018-04-14 06:28:32,,False,False,,0,0,0,I’d take a  runny   nose  rather than a  sore  freaking  throat,/nataliekaedaeng/status/985011900009402368,4879489090,nataliekaedaeng
800,985008525222010885,5af88ae524c1c400cc54e12d,2018-04-14 06:15:07,,False,False,,4,1,2,"I’m now taking the cold and  flu  capsules should have taken when I woke up  coughing , spluttering, with my  throat  &  nose  on fire. Instead, numpty me looked at phone first + was sucked into the hell of watching Theresa May & her pal Trump staggering toward the abyss. Taking us too!",/MoragSievwright/status/985008525222010885,307654529,MoragSievwright
801,985001040696299520,5af88ae524c1c400cc54e12e,2018-04-14 05:45:23,,False,False,,0,1,0,It has officially reached allergy season cus I can’t stop  sneezing  and my eyes  nose  and  throat  all Itch at the same time,/ajoyh1908/status/985001040696299520,962417640709869568,ajoyh1908
802,985000285964783618,5af88ae524c1c400cc54e12f,2018-04-14 05:42:23,,False,False,,5,0,0,"I think my body knows when I’m looking forward to something and is like “hey girl how bout a  headache ? And some body aches Ooooh and a really  sore   throat , AND THEN just for some razzle dazzle let’s throw in a  runny   nose ”  pic.twitter.com/mWYvSVqXuL",/TickleMeEvie/status/985000285964783618,402994190,TickleMeEvie
803,984999746891755522,5af88ae524c1c400cc54e130,2018-04-14 05:40:14,,False,False,,1,0,0,I literally feel like shit . My body is aching and my head is pounding and my dang  nose  is stuffy   and bitchhhhhhh my  throat  is full of flem omg I keep  coughing  and stuff fuck,/__jo2x/status/984999746891755522,2947636348,__jo2x
804,984996771259531264,5af88ae524c1c400cc54e131,2018-04-14 05:28:25,,False,False,,0,0,0,"ugh, i feel like shit. my  nose  is  runny , my  throat  still hurts, haven’t stopped  coughing  and i have a  headache  now.",/yesitsaleee/status/984996771259531264,528875254,yesitsaleee
805,984996578405560320,5af88ae524c1c400cc54e132,2018-04-14 05:27:39,,False,False,,0,0,0,"headache ,  nose  stopped up, built up pressure,  throat  scratchy & i still got 33 minutes left FML ",/_crownedColey/status/984996578405560320,326381294,_crownedColey
806,984971512477339648,5af88ae524c1c400cc54e133,2018-04-14 03:48:03,,False,False,,0,0,0,"When your  nose  is blocked,  throat  is  sore  and swollen and can’t stop  coughing ... sleep? No chance ",/OCEANMEADOWS/status/984971512477339648,113886705,OCEANMEADOWS
807,984967800254095365,5af88ae524c1c400cc54e134,2018-04-14 03:33:18,,False,False,,0,0,0,"So done with being sick... went the whole winter without getting a cold, now i have a  sore   throat  and  runny   nose ... hope i feel better tomorrow ;3; took time to rest today.",/Mexxie_/status/984967800254095365,65562830,Mexxie_
808,984960454782046208,5af88ae524c1c400cc54e135,2018-04-14 03:04:06,,False,False,,0,1,0,"listen imDying. my  throat  is scratchy and hurting, my eyes are spouting waterfalls, I can't stop  coughing  and my  nose  is both stuffy and  runny  (+ we don't have any tissues n there's some creepy ass bug loose in the bathroom so I can't get toilet paper) time to Succumb to death ",/canarycanart/status/984960454782046208,848666931104296960,canarycanart
809,984959535696760832,5af88ae524c1c400cc54e136,2018-04-14 03:00:27,,False,False,,1,0,0,I’m sick. & not the  runny   nose - sore   throat  kind. I need fucking help-doctor give me antidepressants-type sick. And nobody fucking understands..,/__highlo/status/984959535696760832,2768465003,__highlo
810,984958615189680128,5af88ae524c1c400cc54e137,2018-04-14 02:56:48,,False,False,,0,0,0,"My  throat , my  nose , I keep  sneezing , the inside of my face itches   send help!",/ChynnaDemi/status/984958615189680128,31521814,ChynnaDemi
811,984955641381965827,5af88ae524c1c400cc54e138,2018-04-14 02:44:59,,False,False,,0,0,0,"i feel terrible . my  nose   stuffed  up , sinuses ,  headache  & my  throat  . ",/therealbri_1/status/984955641381965827,833338820573659137,therealbri_1
812,984953503062818817,5af88ae524c1c400cc54e139,2018-04-14 02:36:29,,False,False,,0,0,0,"Playoffs and chill with hints of  sore   throat ,  headache , and a  runny   nose . Worst time of the year to get sick.",/Moe_Jaber/status/984953503062818817,249240491,Moe_Jaber
813,984952497591734272,5af88ae524c1c400cc54e13a,2018-04-14 02:32:29,,False,False,,0,1,0,me: has a  runny   nose  and a  sore   throat  also me: hey lemme eat two huge a$$ ice creams,/klaeroline/status/984952497591734272,4766240596,klaeroline
814,984948918625718274,5af88ae524c1c400cc54e13b,2018-04-14 02:18:16,,False,False,,0,0,0,"Spring is great! * Runny   nose *  The warm weather! *Itchy  throat *  No more coats! *Chest congestion*  The flowers are beautiful! *Constant painful cough*  Yup, Spring is great! *For some, not all*",/MariBerryGrace/status/984948918625718274,3181965182,MariBerryGrace
815,984945630547206147,5af88ae524c1c400cc54e13c,2018-04-14 02:05:12,,False,False,,0,0,0,I've been on Staten Island for 1 day and suddenly I have a  sore   throat  and  runny   nose  I am allergic to this hell hole,/richiedes922/status/984945630547206147,2920840253,richiedes922
816,984944725844148224,5af88ae524c1c400cc54e13d,2018-04-14 02:01:36,,False,False,,7,2,0,Symptoms of a head cold: - runny   nose  - sore   throat /cough -braindead attempt to follow news  -rheumy scroll through Zappos for shoes that don't exist -Downton Abbey (again),/BeanGilsdorf/status/984944725844148224,1064067720,BeanGilsdorf
817,984918162352336896,5af88ae624c1c400cc54e13e,2018-04-14 00:16:03,,False,False,,1,0,0,Flu  is about to grip me.   Heavy head.  Sore   throat . Blocked  nose .   Yho and I’m out in the streets. Single.,/MawetuMatyila/status/984918162352336896,193709467,MawetuMatyila
818,984917383935643648,5af88ae624c1c400cc54e13f,2018-04-14 00:12:57,,False,False,,0,0,0,Throat  itchy and keep  sneezing  oh and  runny   nose  want it go away,/beebeeb/status/984917383935643648,188903071,beebeeb
819,984914267735543808,5af88ae624c1c400cc54e140,2018-04-14 00:00:34,,False,False,,0,0,0,"update: just woke up cause i couldn't breathe properly but i can breathe out of my  nose  again,  throat  hurts and i keep  coughing",/angelboytroye/status/984914267735543808,1144604082,angelboytroye
820,984911097407918080,5af88ae624c1c400cc54e141,2018-04-13 23:47:59,,False,False,,2,0,0,"Monday Husband: I feel awful, I think I have a cold. Me: No, it's probably all the pollen. You know, we acquire allergies as we get older.   Last night I got a wicked  sore   throat , started  sneezing ,  nose  dripping, and today feel like crap. IT'S NOT ALLERGIES.  so I apologized",/AbbytheFirst/status/984911097407918080,2598401850,AbbytheFirst
821,984889654423048193,5af88ae624c1c400cc54e142,2018-04-13 22:22:46,,False,False,,1,1,0,"spring has begun. the pollen is back for revenge. itchy/watery eyes,  coughing ,  sneezing , itchy  throat ,  runny /red/ stuffed   nose , hives, swollen/red skin,  nose  bleeds, and more! oh boy am i excited",/azenalee/status/984889654423048193,754686026333904897,azenalee
822,984884315707371520,5af88ae624c1c400cc54e143,2018-04-13 22:01:33,,False,False,,1,0,1,throat  hurts. eyes &  nose  itch. sinus  headache .   welcome to “Spring” ,/jasssy__/status/984884315707371520,1668564157,jasssy__
823,984880102298267648,5af88ae624c1c400cc54e144,2018-04-13 21:44:49,,True,False,,0,1,0,"I lowkey started getting  flu  symptoms, my  nose  is like blocked but also burning, now my  throat  is drying up",/officialmario73/status/984880102298267648,3247002300,officialmario73
824,984875067447259136,5af88ae624c1c400cc54e145,2018-04-13 21:24:48,,False,False,,0,0,0,"Got my  nose  pierced, but fuck  runny   nose  and  sore   throat .",/cm_espejo/status/984875067447259136,288216217,cm_espejo
825,984874371943563264,5af88ae624c1c400cc54e146,2018-04-13 21:22:03,,False,False,,0,0,0,"This morning I woke up feeling sick.  Sore   throat ,  runny   nose  &  headache    #Happyfridaythe13th  ",/iamsinaenae/status/984874371943563264,3677448493,iamsinaenae
826,984866915775496192,5af88ae624c1c400cc54e147,2018-04-13 20:52:25,,False,False,,0,0,0,Sore   throat  +  Runny   nose . Way to enjoy my 3 days off ,/princemarj08/status/984866915775496192,471655090,princemarj08
827,984861339863732224,5af88ae624c1c400cc54e148,2018-04-13 20:30:15,,False,False,,2,0,2,Cough?  Sore   throat ?  Runny   nose ? Follow these three simple steps before you book that GP appointment: 1) Self care 2) NHS Choices 3) See a pharmacist #3beforeGP   http:// bit.ly/NHSChoicesBaNES   pic.twitter.com/xfHB903Fx9,/nhsbanesccg/status/984861339863732224,2987414481,nhsbanesccg
828,984853196081385473,5af88ae624c1c400cc54e149,2018-04-13 19:57:54,,False,False,,4,1,0,"Just last week I was thinking how thankful I was to not have gotten a cold this year. Now here I am,  fever ,  sore   throat ,  runny   nose ,  headache , and water eyes....",/annettelaw27/status/984853196081385473,607821891,annettelaw27
829,984853052514594816,5af88ae624c1c400cc54e14a,2018-04-13 19:57:20,,False,False,,0,0,0,"Your favorite bought  throat  lozenges and eucalyptus oil for the  flu  but forgot it in her friends car... It is I, I am your dumb friend that has a blocked  nose  and an irritated  throat .",/fancy_gill/status/984853052514594816,241973769,fancy_gill
830,984847137371402240,5af88ae624c1c400cc54e14b,2018-04-13 19:33:49,,False,False,,1,2,0,"// So... for the past three days I've had a  sore   throat  that makes it uncomfortable to swallow,  sneezing , and a  runny /stuffy  nose .   Kill me.",/TsundereUnit/status/984847137371402240,888494696619802625,TsundereUnit
831,984841666317107201,5af88ae624c1c400cc54e14c,2018-04-13 19:12:05,,False,False,,0,1,0,my  throat  is already itching and my  nose  is running and i cant stop  sneezing  but u kno what imma train my body to get used to it and hopefully get rid of my allergy,/xbtrisyia/status/984841666317107201,187858788,xbtrisyia
832,984832387610824705,5af88ae624c1c400cc54e14d,2018-04-13 18:35:13,,False,False,,0,0,0,"# Spring  through #allergy  season with these tips to survive the itchy eyes,  runny   nose ,  sore   throat  and  sneezing .  http:// ow.ly/GMAZ30jiaBu   pic.twitter.com/xEkDD8Mnwr",/NJHealth/status/984832387610824705,18309666,NJHealth
833,984832133846925313,5af88ae624c1c400cc54e14e,2018-04-13 18:34:12,,False,False,,0,0,0,"Measles are highly contagious and starts with  fever ,  runny   nose , cough, red eyes and  sore   throat . It’s followed by a rash. Make sure you and your child are protected with measles, mumps and rubella (MMR) vaccine. Visit an immunization clinic nearest you!  http:// ow.ly/MGYg30jtORC   pic.twitter.com/iGoG1H8FMA",/TulsaHealthDept/status/984832133846925313,40081866,TulsaHealthDept
834,984828163288055808,5af88ae624c1c400cc54e14f,2018-04-13 18:18:26,,False,False,,0,0,0,Can't sleep.  Headache .  Stuffed   nose . Flaming  throat . ,/jhemhaeee/status/984828163288055808,126860029,jhemhaeee
