,ID,_id,datetime,has_media,is_reply,is_retweet,medias,nbr_favorite,nbr_reply,nbr_retweet,text,url,user_id,usernameTweet
1165,982545801187643393,5af88afe24c1c400cc54e29a,2018-04-07 11:09:08,,False,False,,16,3,0,stomach: aches  nose :  runny   throat :  sore   yes im ready for this midterm ,/SWAGBOISUGA/status/982545801187643393,43541826,SWAGBOISUGA
1166,982543986580709376,5af88afe24c1c400cc54e29b,2018-04-07 11:01:55,,True,False,,1,1,1,"Sore   throat  ,  headache  & my  nose  keep running.",/Diaaamonddx1/status/982543986580709376,952392296657510401,Diaaamonddx1
1167,982536081051672576,5af88afe24c1c400cc54e29c,2018-04-07 10:30:31,,False,False,,0,1,0,My  throat .. smh.. can't breathe through  nose  so my  throat  probably got dry overnight and now I just keep on  coughing  ,/Mezzarthy/status/982536081051672576,267180190,Mezzarthy
1168,982533322281660416,5af88afe24c1c400cc54e29d,2018-04-07 10:19:33,,False,False,,1,1,0,"lana is the perfect song to sing when u have a  sore   throat , a  runny   nose , a  fever",/eijikashi/status/982533322281660416,848606911293399040,eijikashi
1169,982532171322798080,5af88afe24c1c400cc54e29e,2018-04-07 10:14:58,,False,False,,9,2,0,"i've been up all night, having a pounding  headache , being sick. can't breathe through my  nose , and my  throat  hurts. honestly i just want to sleep.",/xAlisMsp/status/982532171322798080,958418645872513024,xAlisMsp
1170,982516190751969280,5af88afe24c1c400cc54e29f,2018-04-07 09:11:28,,False,False,,1,0,0,"i still have a  sore   throat , a  runny   nose , my head aches, my body aches, everything aches, i can't feel my toes, i'm  coughing  24/7. yes, i will be dead by the end of the week.",/battleborns/status/982516190751969280,804042697,battleborns
1171,982511809360990208,5af88afe24c1c400cc54e2a0,2018-04-07 08:54:04,,False,False,,1,0,0,"My body has realised that a surefire way to get me to sleep is to threaten illness (running  nose ,  sore   throat ,  headache ) so I get to bed early, but never actually let me get ill. Constantly running at 60%",/NiaCJohn/status/982511809360990208,414186702,NiaCJohn
1172,982508164246630400,5af88afe24c1c400cc54e2a1,2018-04-07 08:39:35,,False,False,,2,0,0,"Aaand I’m starting to get sick -  sore   throat ,  runny   nose ,  headache . Studying will be a fucking bliss now /s",/azupyon_tv/status/982508164246630400,897804411732361216,azupyon_tv
1173,982496562583654401,5af88afe24c1c400cc54e2a2,2018-04-07 07:53:29,,False,False,,1,0,0,"Hate being sick   shit is annoying  coughing ,  runny   nose , scratchy  throat  wtf bro    pic.twitter.com/wPXzYHE6HW",/navvuitton_/status/982496562583654401,973907607705542658,navvuitton_
1174,982490987413946368,5af88afe24c1c400cc54e2a3,2018-04-07 07:31:19,,False,False,,0,1,0,"Update: I'm sick. can't tell if I was sick before ytd because I had  runny   nose  the day before ytd and I thought it's prob allergies, so I thought the same thing this morning.... but eh, I'm starting to have the cough and  sore   throat  so fuck lol ",/deletingfat/status/982490987413946368,4654811773,deletingfat
1175,982487054217981952,5af88afe24c1c400cc54e2a4,2018-04-07 07:15:42,,False,False,,1,0,0,"Sore   throat , ear ache,  headache , stuffy  nose , this is not the time taylor to get sick. ",/Taaylor_K/status/982487054217981952,615894070,Taaylor_K
1176,982482215719391232,5af88afe24c1c400cc54e2a5,2018-04-07 06:56:28,,False,False,,0,0,0,now I got a  runny   nose  but my itchy  throat  gone,/sachaarshae/status/982482215719391232,2242943354,sachaarshae
1177,982481993089847297,5af88b0024c1c400cc54e2a6,2018-04-07 06:55:35,,False,False,,0,0,0,"Week 6 am i pregnant, or just sick fit pregnancy and baby homeopathic remedy for  sore   throat  and  runny   nose  -  http:// bit.ly/2EsjLZc  ",/angelhellf/status/982481993089847297,124081287,angelhellf
1178,982469900152090624,5af88b0024c1c400cc54e2a7,2018-04-07 06:07:32,,True,False,,1,0,0,"I've been sick the past couple days too...not vomiting but chest feels heavy,  throat  is  sore , a lot of  runny   nose ...people at work have been sick too...I have to do overtime tomorrow argh",/neutrino78x/status/982469900152090624,28936899,neutrino78x
1179,982463655957663744,5af88b0024c1c400cc54e2a8,2018-04-07 05:42:43,,False,False,,0,0,0,"I feel like I've been hit by a bus... Ribs hurt from  coughing ,  sore   throat , and all  stuffed  up ... I need soup, gingerale, and some good music",/SexyLette81/status/982463655957663744,167012852,SexyLette81
1180,982451630598705153,5af88b0024c1c400cc54e2a9,2018-04-07 04:54:56,,False,False,,0,1,0,The past 2 days this changing weather gave me a  runny   nose  and soar  throat  and cough. I overdosed on mucinex threraflu and ibuprofin. I had pains and chills. Drank tea and burned my gums on hot pizza.,/neosouldude/status/982451630598705153,3159009573,neosouldude
1181,982444530204139520,5af88b0024c1c400cc54e2aa,2018-04-07 04:26:43,,False,False,,2,0,0,"I might have either tonsillitis or strep  throat  along with a stuffy  nose  and can't hear outta my left ear, have a  headache  and feel very chilled.... this sickness has started and won't end till the end of the month :(",/brxwnskiinn/status/982444530204139520,541777023,brxwnskiinn
1182,982431259820511232,5af88b0024c1c400cc54e2ab,2018-04-07 03:33:59,,True,False,,0,1,0,I got soar ass  throat  plugged up  nose  and a  fever . Its a great time,/raya_e46/status/982431259820511232,968336957519654914,raya_e46
1183,982431237561348096,5af88b0024c1c400cc54e2ac,2018-04-07 03:33:54,,False,False,,0,1,0,"1/2 I think I’ve still got a few days of recovery ahead.  Nose  is irritated from the oxygen, as is my  throat  from the nebuliser used to clear my chest.  Coughing  even with three pillows. Neck and  throat  tender and bruised. Stomach is bruised from the injections to stop blood clots.",/wdwfan1973/status/982431237561348096,20977987,wdwfan1973
1184,982430570381705216,5af88b0024c1c400cc54e2ad,2018-04-07 03:31:15,,False,False,,0,0,0,"""You may have muscle aches, a scratchy or  sore   throat , watery eyes, and a  headache . The  flu  starts suddenly and hits hard. You will probably feel weak and tired and have a  fever , dry cough, a  runny   nose , chills, muscle aches, a bad  headache , eye pain, and a sorethroat."" great",/DemiseEnzly/status/982430570381705216,958657747,DemiseEnzly
1185,982423656012763136,5af88b0024c1c400cc54e2ae,2018-04-07 03:03:46,,False,False,,3,0,0,It's not like the smoke disappears instantly when he boards. I now have a  sore   throat  and a  runny   nose . How is my fare equal to that of someone who intentionally breaks the rules? ,/inksharknet/status/982423656012763136,16789903,inksharknet
1186,982409940320047104,5af88b0024c1c400cc54e2af,2018-04-07 02:09:16,,False,False,,54,66,1,"I can't shake this cold. I've had  fever ,  coughing , stuffy  nose , body aches, and a  sore   throat . It's miserable.",/MichellePhelps/status/982409940320047104,25150629,MichellePhelps
1187,982381737064857600,5af88b0024c1c400cc54e2b0,2018-04-07 00:17:12,,False,False,,10,2,0,"So I decided to kill a spider with some pepper spray. It worked but worse idea ever. Now I can’t stop  coughing , my  nose  is all  runny  and it’s burning my  throat  jaja ",/barrientosmigu1/status/982381737064857600,2921878832,barrientosmigu1
1188,982381199099297797,5af88b0024c1c400cc54e2b1,2018-04-07 00:15:04,,False,False,,2,2,0,"If anyone is curious, here is what my symptoms have been - Runny   nose  - sneezing  -heavy breathing -Swollen  throat  - coughing  -passing out -vomiting -shaky knees - headache",/Gentle_Heart245/status/982381199099297797,879489326517825536,Gentle_Heart245
1189,982379931115061255,5af88b0024c1c400cc54e2b2,2018-04-07 00:10:01,,False,False,,2,2,1,"To my followers, I have a bit of a illness ATM. Idk what it is but my  throat  is swollen and painful, my  nose  is  runny , I can't breathe good etc. So if I ever stop replying to anyone, please forgive me as I am not at my best right now. I have passed out twice from not being able-",/Gentle_Heart245/status/982379931115061255,879489326517825536,Gentle_Heart245
1190,982354676116066304,5af88b0024c1c400cc54e2b3,2018-04-06 22:29:40,,False,False,,0,1,0,"can’t sleep at all, blocked  nose ,  throat  pain, high  fever  and on top of all, meds making me so exhausted and dizzy, maaj’jal hai ke neend aye mujhy#dying  never gonna eat ice cream again, number one enemy of my health",/Somia_Tweets/status/982354676116066304,1713760034,Somia_Tweets
1191,982326295928295424,5af88b0024c1c400cc54e2b4,2018-04-06 20:36:54,,True,False,,2,0,0,That’s honestly probably how we got sick!! I’ve had a  sore   throat  for 2 days and a really  runny   nose  and my sinuses hurt so bad ,/Karina_Maree26/status/982326295928295424,731193534,Karina_Maree26
1192,982323023188406272,5af88b0024c1c400cc54e2b5,2018-04-06 20:23:54,True,False,False,[],0,0,0,"the  nose  and face is swollen:   https://www. youtube.com/watch?v=iSkF0u jRPz4&feature=youtu.be   …  this went on all night...and I woke up with a  headache , burning sensations in  nose , eyes and  throat   https:// twitter.com/roshini911/sta tus/982281494398844929   …",/roshini911/status/982323023188406272,130616568,roshini911
1193,982317242229673989,5af88b0024c1c400cc54e2b6,2018-04-06 20:00:55,,False,False,,0,0,0,"Feel Better Miso Soup // Have a little one with a  runny   nose  and cough? Warm miso soup with tofu soothes a  sore   throat  and helps hydrate your sniffling kiddo, and the plain rice and broccoli are easy on the tummy.…  http:// thelittleveggiekitchen.com/2018/04/06/fee l-better-miso-soup/   … pic.twitter.com/dD0vLY0xzK",/JaniceVeggie/status/982317242229673989,971801496953040896,JaniceVeggie
1194,982309440648105984,5af88b0024c1c400cc54e2b7,2018-04-06 19:29:55,,False,False,,0,0,0,"migraine, ear ache, cough,  sore   throat , running  nose , and  sneezing , i wonder what disease google symptoms will diagnose me with",/thecassidyh/status/982309440648105984,1716567998,thecassidyh
1195,982285781082533888,5af88b0024c1c400cc54e2b8,2018-04-06 17:55:54,,False,False,,1,0,0,"I 100% feel like this is allergies.  I have no  fever . I feel ok OTHER THAN the constant  sneezing , itchy eyes, itchy  nose  and scratchy  throat  (from drainage).  So I think I’m ok to make it to the con.   The moment I get a  fever  tho, I’ll retreat to my hotel and quarantine myself.  https:// twitter.com/nikkiexdee/sta tus/982280856399237120   …",/NikkiExDee/status/982285781082533888,2531015941,NikkiExDee
1196,982282005382483969,5af88b0024c1c400cc54e2b9,2018-04-06 17:40:54,,False,False,,2,0,0,"Sore   throat ,  runny   nose ,  headache , netflix and blanket = My kind of friday night.",/joyceeannn/status/982282005382483969,486600218,joyceeannn
1197,982280400650170368,5af88b0124c1c400cc54e2ba,2018-04-06 17:34:32,,False,False,,0,0,0,My  throat  is starting to itch and my baby has had a  runny   nose  for like a week   where tf is spring,/Datchickapple/status/982280400650170368,957774214085464064,Datchickapple
1198,982277271812624386,5af88b0124c1c400cc54e2bb,2018-04-06 17:22:06,,False,False,,0,0,0,This morning I had my  sore   throat  and I knew right away it is going to be  fever ...n I took my medicine n went to work as usual but guess what it is night time and I felt like crap..my blocked  nose  imitating me.. I can't sleep at all  pic.twitter.com/OQ3yZcroO6,/yulinaRich/status/982277271812624386,1552946304,yulinaRich
1199,982277080862769152,5af88b0124c1c400cc54e2bc,2018-04-06 17:21:20,,False,False,,0,1,0,Sore   throat  &  runny   nose  kinda weather,/mutiapelayati/status/982277080862769152,77715343,mutiapelayati
1200,982273865412788224,5af88b0124c1c400cc54e2bd,2018-04-06 17:08:33,,True,False,,1,0,0,That is perfect way to ease hay  fever  for sure!!!!!  I need to get menthol essential oil to treat my  nose . Thank you for letting me know. I'm sure that it heals my  throat  too!,/gokusaishiki_h/status/982273865412788224,96910960,gokusaishiki_h
1201,982272308462084096,5af88b0124c1c400cc54e2be,2018-04-06 17:02:22,,False,False,,0,0,0,"Hello vomiting,  headache ,  runny   nose ,  sore   throat    We meet again, it’s been a while & I hate you all   Hayyyy sana mawala agad ",/wensajol/status/982272308462084096,1108590715,wensajol
1202,982264897034534913,5af88b0124c1c400cc54e2bf,2018-04-06 16:32:55,,False,False,,0,0,0,"Ahhh the joys of pollen season.  Sore   throat ,  runny   nose , itchy eyes, that sinus  headache  right above my left eye that just won't quit.  Ugh.",/WinterwoodGrace/status/982264897034534913,885566406502211584,WinterwoodGrace
1203,982260469405634560,5af88b0124c1c400cc54e2c0,2018-04-06 16:15:20,,False,False,,43,1,31,"sandeul  sneezing , baro clearing his  throat , and gongchan scratching his  nose — on loop  pic.twitter.com/9R2qNF2klz",/brightsideul/status/982260469405634560,469906270,brightsideul
1204,982260009902817282,5af88b0124c1c400cc54e2c1,2018-04-06 16:13:30,,False,False,,1,1,0,remember when i said there's nothing worse than having a  runny   nose ? i fucking lied. having a  sore   throat  is THE WORST THING EVER.,/battleborns/status/982260009902817282,804042697,battleborns
1205,982256962803924997,5af88b0124c1c400cc54e2c2,2018-04-06 16:01:24,,False,False,,6,2,0,"I've been trying to resist tweeting about it bc I whined about my back for so long, but my  throat  is on fire and my  nose  is  runny  and plugged up at the same time and I couldn't sleep and I am going full Kuzco Meltdown and need to world to be aware of my pain  pic.twitter.com/DHp0AVDFpn",/gatesofglass/status/982256962803924997,59562620,gatesofglass
1206,982252163651985411,5af88b0124c1c400cc54e2c3,2018-04-06 15:42:19,,True,False,,0,0,0,"flu  has mostly targeted me these past days, so I always keep myself warm and avoid dusty places because my  nose  is the first thing to be targeted by this  flu ,  I also drink warm water with lemon every day in the morning to protect my  throat  #ClicksFightTheFlu",/TakalaniRambau/status/982252163651985411,2152244674,TakalaniRambau
1207,982248356880596993,5af88b0124c1c400cc54e2c4,2018-04-06 15:27:12,,False,False,,0,0,0,my - ears hurts - jaw hurts - stomach hurts - my  throat  hurts I have - a running  nose  - a cough - a lot of mucus & I keep on -  sneezing  can a doctor from twitter hmu !,/figyaskatin/status/982248356880596993,2213396071,figyaskatin
1208,982244275873202176,5af88b0124c1c400cc54e2c5,2018-04-06 15:10:59,,False,False,,0,2,0,Combinations of  sore   throat  and  runny   nose  are never fun ajsbshabd,/_frhshu/status/982244275873202176,2332996777,_frhshu
1209,982244217991839744,5af88b0124c1c400cc54e2c6,2018-04-06 15:10:45,,False,False,,2,1,0,"not trying to be dramatic or anything...but I've had a  sore   throat ,  fever ,  runny   nose  and a  headache  since yesterday...i wanna ***",/ValerieValerieX/status/982244217991839744,485519416,ValerieValerieX
1210,982236491471511552,5af88b0124c1c400cc54e2c7,2018-04-06 14:40:03,,False,False,,1,0,3,"Love #Oscillo  for flu-like symptoms? Then you'll like Coldcalm for  sneezing ,  runny   nose  & minor  sore   throat .  http:// bit.ly/241tRJw   pic.twitter.com/tfGRZ2jTtK",/OscilloUSA/status/982236491471511552,17876394,OscilloUSA
1211,982234623680757760,5af88b0124c1c400cc54e2c8,2018-04-06 14:32:37,,False,False,,1,0,0,"Cold virus is such a slag, starts of  sore   throat , then blocked  nose , then  runny   nose , then tickly cough, finally bad chest .. engulf my whole body why don’t you ",/LaurenBrown0/status/982234623680757760,241548794,LaurenBrown0
1212,982232242226323456,5af88b0124c1c400cc54e2c9,2018-04-06 14:23:10,,False,False,,1,0,0,"Waking at 5am  sneezing ,  nose  dripping,  throat  itching & eyes watering. Yup. Plant jizz all up in…  https://www. instagram.com/p/BhOpXc7l5mi/  ",/fnkolvr/status/982232242226323456,850203781744676865,fnkolvr
1213,982226369772847104,5af88b0124c1c400cc54e2ca,2018-04-06 13:59:50,,False,False,,0,0,1,"I had the  flu  all week. But #InvasionOfPrivacy  cured me of all the  flu  symptoms I had. No more  sore   throat , weak body, loss of appetite, chest and  nose  congestion, stuffy  nose ,  coughing  etc... I’m back and 100% better! Thank you @iamcardib",/MrTayLamar/status/982226369772847104,55101852,MrTayLamar
1214,982223631609561089,5af88b0124c1c400cc54e2cb,2018-04-06 13:48:57,,False,False,,2,0,0,Is there a point to sleeping if you just wake up every half hour  coughing  and hacking from a clogged  nose  going down your  throat ??  Feels like I'm not even resting at all.,/Naoma_Hiru/status/982223631609561089,3349962665,Naoma_Hiru
1215,982220608359419906,5af88b0124c1c400cc54e2cc,2018-04-06 13:36:56,,False,False,,2,1,0,"This  flu  I have is killing me.... blocked  nose ,  sore   throat  and back pains. What alcohol can help me with this?",/Crazy_Del/status/982220608359419906,363944846,Crazy_Del
1216,982200605107150850,5af88b0124c1c400cc54e2cd,2018-04-06 12:17:27,,False,False,,3,0,0,"Woke up with  sore   throat ,  stuffed  up  nose , and pounding  headache . Must be exam season.",/MyBestyWesty/status/982200605107150850,50449290,MyBestyWesty
1217,982196537638830080,5af88b0324c1c400cc54e2ce,2018-04-06 12:01:17,,False,False,,2,0,0,【体調不良を伝える】 I have...  a  headache （頭痛がする） a stuffy  nose （鼻が詰まってる） a  runny   nose （鼻水が出る） a  sore   throat （喉が痛い） a  fever （熱がある） a rash（湿疹がある）,/HAGULOG/status/982196537638830080,776769512360124416,HAGULOG
1218,982186054286434305,5af88b0324c1c400cc54e2cf,2018-04-06 11:19:38,,False,False,,0,0,0,"My  throat  feels kind hurt and my  nose  is a bit  runny . Yet surprisingly, I continue to color this---  pic.twitter.com/DePZxUsqoI",/longlivekuchen/status/982186054286434305,3072148920,longlivekuchen
1219,982168315748470789,5af88b0324c1c400cc54e2d0,2018-04-06 10:09:08,,False,False,,1,0,1,"allergies got me breathing through one nostril,  nose  dripping,  sneezing , with a  sore   throat  and i’m over it!!  pic.twitter.com/p3Nzl917NK",/allemonet/status/982168315748470789,3238113303,allemonet
1220,982162881843101696,5af88b0324c1c400cc54e2d1,2018-04-06 09:47:33,,False,False,,0,0,0,"Don’t know what is keeping me up more~severe  sore   throat ,  runny   nose , should pain, eye inflammation or tooth ache #toolatefornyquil  #goingtobeworthlessatwork",/abbamaggiebuddy/status/982162881843101696,232079810,abbamaggiebuddy
1221,982156247276208128,5af88b0324c1c400cc54e2d2,2018-04-06 09:21:11,,False,False,,2,0,0,"told mk last night to not get near me, touch me, etc cus i’m not tryna get sick but dude doesn’t ever listen now my  throat ,  nose  feelin super funny & i can’t stop  sneezing    smh",/cclxss/status/982156247276208128,28954473,cclxss
1222,982152723138199552,5af88b0324c1c400cc54e2d3,2018-04-06 09:07:11,,False,False,,4,5,0,"Sore   throat ,  runny   nose .    Currently doing a decent Barry White impersonation whenever I speak. ",/JessicaNellH/status/982152723138199552,920905923949932544,JessicaNellH
1223,982147142117539840,5af88b0324c1c400cc54e2d4,2018-04-06 08:45:00,,False,False,,0,0,0,Cause my heating is broke keep waking up with such a  sore   throat  and  runny   nose  ,/TheRealShanBowe/status/982147142117539840,281809622,TheRealShanBowe
1224,982128511803469824,5af88b0324c1c400cc54e2d5,2018-04-06 07:30:58,,False,False,,0,0,0,"Yesterday I felt my ears almost hurting like an earache.... today I have a stuffy  nose , chest pains and an annoying  headache ..... and my  throat  is a lil  sore  but I can’t really tell. If that makes any sense at all.",/sambabi/status/982128511803469824,33039012,sambabi
1225,982123295360233472,5af88b0324c1c400cc54e2d6,2018-04-06 07:10:15,,False,False,,0,0,0,"runny   nose , sneezin,  throat  itching=fml",/_chvnna/status/982123295360233472,734260105114451968,_chvnna
1226,982120503878926338,5af88b0324c1c400cc54e2d7,2018-04-06 06:59:09,,False,False,,4,3,0,Calling it a night early   I have a  runny   nose  and  sore   throat . I hope it clears up by tomorrow,/GhostMillk/status/982120503878926338,1191647448,GhostMillk
1227,982112250830897152,5af88b0324c1c400cc54e2d8,2018-04-06 06:26:22,,False,False,,10,7,0,"Oh well today is Friday yay! I'm soooo sick that I'm not gonna go to school today, like literally I have blocked  nose , my  throat  realllly hurts and I think a have a  fever .... Wish my luck not to die",/yyemr/status/982112250830897152,4907953427,yyemr
1228,982111805731295232,5af88b0324c1c400cc54e2d9,2018-04-06 06:24:35,,False,False,,0,0,0,also my  runny   nose  is gone but now i have the worst  sore   throat  ever so id rather go back to blowing my  nose  a lot instead of not even being able to swallow water,/dreamyalchemy/status/982111805731295232,873518408737869826,dreamyalchemy
1229,982107605504937986,5af88b0324c1c400cc54e2da,2018-04-06 06:07:54,,False,False,,1,1,0,Back to work tomorrow and I have a  sore   throat  and  runny   nose ...screw this going to bed #OneMoreDay  #Icandothis,/KelseyFergison/status/982107605504937986,100694740,KelseyFergison
1230,982106191831552001,5af88b0324c1c400cc54e2db,2018-04-06 06:02:17,,False,False,,0,0,0,Treat  runny   nose  and  sore   throat  at home instantly! soothe strep  throat  pain -  http:// bit.ly/2EoCO6D  ,/angelhellf/status/982106191831552001,124081287,angelhellf
1231,982102142528798721,5af88b0324c1c400cc54e2dc,2018-04-06 05:46:12,,False,False,,0,0,0,Shit be relaxing af until you wake up with a  sore   throat  &  runny   nose   https:// twitter.com/maldtexas/stat us/982095444963659776   …,/BadGalRaja/status/982102142528798721,571477631,BadGalRaja
1232,982088146262245381,5af88b0324c1c400cc54e2dd,2018-04-06 04:50:35,,False,False,,1,0,0,"no but on a serious note, my  throat  is killing me, my  nose  hurts from constantly blowing my  nose . I have a  headache  that comes and goes! and it’s not just me ",/hippieapes/status/982088146262245381,1698095240,hippieapes
1233,982073813960658950,5af88b0324c1c400cc54e2de,2018-04-06 03:53:37,,False,False,,10,0,0,"Surviving through college and work with a  sore   throat ,  runny   nose , and random headaches  pic.twitter.com/SuHdKg7iYn",/theDALEAtweets/status/982073813960658950,543843052,theDALEAtweets
1234,982070327399370752,5af88b0324c1c400cc54e2df,2018-04-06 03:39:46,,False,False,,0,0,0,"Relation to a graminaceae, cane is manageable to turn anyplace and is ready at extremely sale-priced expenditure i have a  sore   throat  and  runny   nose . Change while it is inborn to Island Early Fowl, it has grow into a office of the lop creation of more one-half of...",/angelhellf/status/982070327399370752,124081287,angelhellf
1235,982054921024368640,5af88b0324c1c400cc54e2e0,2018-04-06 02:38:33,,True,False,,2,0,0,"I’ll have to miss this one, due to pesky microscopic rhinoceroses  . They may include  sore   throat ,  runny   nose ,  sneezing ,  headache , and  fever .",/AlanSchtweetz/status/982054921024368640,16870451,AlanSchtweetz
1236,982014438214635520,5af88b0324c1c400cc54e2e1,2018-04-05 23:57:41,,False,False,,0,0,0,"i have to go to the doctor's tomorrow cos i haven't stopped  coughing  for about 2 weeks and now i have a lot of mucus blocking my  nose  and  throat , and my ears are affected too ugh",/kingdomartsjpg/status/982014438214635520,306754380,kingdomartsjpg
1237,982009088409300999,5af88b0424c1c400cc54e2e2,2018-04-05 23:36:26,,False,False,,0,0,0,"My lips dry, my  nose  dry, my  throat  dry.   I refuse these  flu  signs. Nope, Kwete,  Não!",/ChikoChiobvu/status/982009088409300999,971749525,ChikoChiobvu
1238,982003356670615555,5af88b0424c1c400cc54e2e3,2018-04-05 23:13:39,,True,False,,0,0,0,flu  :( my  nose  is  stuffed  and  throat  hurts,/GopherCrazy/status/982003356670615555,708490436495728640,GopherCrazy
1239,981990827932176386,5af88b0424c1c400cc54e2e4,2018-04-05 22:23:52,,False,False,,1,1,0,Allergies are trying to murder me. At least today my sinuses decided to drain properly out my  nose  instead of down my  throat  like it has the past few days. A lot less  coughing  and choking that way.,/chibimarrow/status/981990827932176386,19679582,chibimarrow
1240,981968864669044736,5af88b0424c1c400cc54e2e5,2018-04-05 20:56:36,,False,False,,0,1,0,i have a test next period that im gonna fail Bad like my ears hurt my  nose  is  runny  my  throat  hurts im so drowsy i Hate living,/megamilfana/status/981968864669044736,751273624074461185,megamilfana
1241,981958616600272896,5af88b0424c1c400cc54e2e6,2018-04-05 20:15:52,,False,False,,5,4,0,"So this is what I'm taking to get better, yesterday at work was just a day of  sneezing  and running  nose . New nurofen are half pice @AldiUK  and don't contain paracetamol so can still have the lemon lemsip. Cough medicine for day and night and soothers for my  throat .    pic.twitter.com/qpub3oGBvk",/_SapphireSarah/status/981958616600272896,68285622,_SapphireSarah
1242,981949635399966720,5af88b0424c1c400cc54e2e7,2018-04-05 19:40:11,,False,False,,0,0,0,"Another update: i have a  fever , migraine,  runny   nose ,  throat  is super  sore  and swollen, my stomach hurts, my body feels achy and even though im just in bed doing nothing my heart is racing",/charliexmegan/status/981949635399966720,223912216,charliexmegan
1243,981948897286410247,5af88b0424c1c400cc54e2e8,2018-04-05 19:37:15,,False,False,,1,3,0,"okay update; im more sick than earlier skdjdjd i have a  fever , migraine,  runny   nose ,  throat  is super  sore  and swollen, my stomach hurts, my body feels achy and even though im just in bed doing nothing my heart is racing",/angelicjooheon/status/981948897286410247,808909938814832642,angelicjooheon
1244,981944606781779968,5af88b0424c1c400cc54e2e9,2018-04-05 19:20:12,,False,False,,0,0,0,"I think I'm getting sick.  Sore   Throat ,  coughing  and stuffy  nose    not today Satan! I got a trip to take!",/JordanDenzel/status/981944606781779968,30316198,JordanDenzel
